{
  "$schema": "./evidence-index.v3.schema.json",
  "schema_version": "catalog-switch-evidence-index/v3",
  "index_version": 3,
  "as_of": "2026-08-19T17:35:00Z",
  "baseline_architecture_commit": "1db7703e3078ce3236c4655816312416145eb709",
  "rejected_predecessor_commit": "7dc39ea7903c8aa19fe8a8269ab435268a7ae4b7",
  "scope": {
    "update_kind": "evidence-index-only",
    "backend_selection_allowed": false,
    "final_adr_claim_allowed": false,
    "live_resources_allowed": false,
    "empirical_backends": [
      "kubernetes",
      "node-vm",
      "cerebrium"
    ],
    "external_comparator": "cerebrium",
    "documentation_only": [
      "modal"
    ]
  },
  "positive_evidence_policy": {
    "exact_commit_required": true,
    "independent_acceptance_required": true,
    "source_blob_hash_required": true,
    "review_record_commit_required": true,
    "review_record_blob_hash_required": true,
    "reviewed_commit_must_equal_source_commit": true,
    "embedded_review_metadata_trusted": false,
    "label_change_can_promote": false
  },
  "review_record_bundle": {
    "repository": "https://github.com/nebius/nebius-solutions-library",
    "commit_sha": "0c47062047d19b3271350e66cd86ee0de87a57e0",
    "commit_url": "https://github.com/nebius/nebius-solutions-library/commit/0c47062047d19b3271350e66cd86ee0de87a57e0",
    "path": "nim-fast-start/faststart-v2/catalog-switch/architecture/review-records.v1.json",
    "blob_sha256": "30ce34f768d382c2b74873d681475a9b813f68483ec2037e6b02f8dcfe2d71f7",
    "schema_path": "nim-fast-start/faststart-v2/catalog-switch/architecture/review-records.v1.schema.json",
    "schema_blob_sha256": "69e67c47b269b92aed21c264aa3382a9a23964ace9eb9f9cf4c745d533732ba8"
  },
  "entries": [
    {
      "id": "EV3-METRIC-BA49",
      "lane": "request-slo",
      "subject": "Frozen external-T0 benchmark contract",
      "backends": [
        "backend-neutral"
      ],
      "classification": "provenance-unverified",
      "measurement_kind": "contract",
      "positive_evidence_eligible": false,
      "decision_score_eligible": false,
      "allowed_claim": "The exact source blob exists, but positive use is blocked until an independently authored committed acceptance record is bound.",
      "excluded_claims": [
        "independently accepted positive evidence",
        "backend decision input"
      ],
      "provenance": {
        "repository": "https://github.com/nebius/nebius-solutions-library",
        "commit_sha": "ba49c9e20f194e0f419d4209608904cc9335219d",
        "commit_url": "https://github.com/nebius/nebius-solutions-library/commit/ba49c9e20f194e0f419d4209608904cc9335219d",
        "path": "nim-fast-start/faststart-v2/performance/request_slo/event.schema.json",
        "blob_sha256": "a8371e8f0e3713ccbf3db8658ae144e2c62b2ace223dbfd6ae7761d1a2cf3a52"
      },
      "review_record_id": "RR1-METRIC-BA49-PROVENANCE-UNVERIFIED"
    },
    {
      "id": "EV3-CATALOG-9ABD",
      "lane": "catalog",
      "subject": "Versioned catalog inventory",
      "backends": [
        "backend-neutral"
      ],
      "classification": "provenance-unverified",
      "measurement_kind": "contract",
      "positive_evidence_eligible": false,
      "decision_score_eligible": false,
      "allowed_claim": "The exact source blob exists, but positive use is blocked until an independently authored committed acceptance record is bound.",
      "excluded_claims": [
        "independently accepted positive evidence",
        "backend decision input"
      ],
      "provenance": {
        "repository": "https://github.com/nebius/nebius-solutions-library",
        "commit_sha": "9abd49204e7dbfb9be17ebf6c3f213227a88e5ca",
        "commit_url": "https://github.com/nebius/nebius-solutions-library/commit/9abd49204e7dbfb9be17ebf6c3f213227a88e5ca",
        "path": "nim-fast-start/faststart-v2/catalog/catalog.json",
        "blob_sha256": "831c0517c0df3c92e3b8e802b609c08dbc5f2c0eb945fc0d21830e457a71d6ce"
      },
      "review_record_id": "RR1-CATALOG-9ABD-PROVENANCE-UNVERIFIED"
    },
    {
      "id": "EV3-SECURITY-9CFB",
      "lane": "security-reliability",
      "subject": "Internal-backend threat model",
      "backends": [
        "kubernetes",
        "node-vm"
      ],
      "classification": "provenance-unverified",
      "measurement_kind": "contract",
      "positive_evidence_eligible": false,
      "decision_score_eligible": false,
      "allowed_claim": "The exact source blob exists, but positive use is blocked until an independently authored committed acceptance record is bound.",
      "excluded_claims": [
        "independently accepted positive evidence",
        "backend decision input"
      ],
      "provenance": {
        "repository": "https://github.com/nebius/nebius-solutions-library",
        "commit_sha": "9cfbc1b1311a1f784a407889b215aaec5200fe0e",
        "commit_url": "https://github.com/nebius/nebius-solutions-library/commit/9cfbc1b1311a1f784a407889b215aaec5200fe0e",
        "path": "nim-fast-start/faststart-v2/catalog-switch/security-reliability/threat_model.json",
        "blob_sha256": "a9bfccaf2425b75beb40ed6265736aa1d97b3a26327ac37db3a9b92877bbb765"
      },
      "review_record_id": "RR1-SECURITY-9CFB-PROVENANCE-UNVERIFIED"
    },
    {
      "id": "EV3-BROKER-CPU-2291",
      "lane": "resource-broker",
      "subject": "Fresh CPU lease and exact-ID cleanup smoke",
      "backends": [
        "node-vm"
      ],
      "classification": "provenance-unverified",
      "measurement_kind": "contract",
      "positive_evidence_eligible": false,
      "decision_score_eligible": false,
      "allowed_claim": "The exact source blob exists, but positive use is blocked until an independently authored committed acceptance record is bound.",
      "excluded_claims": [
        "independently accepted positive evidence",
        "backend decision input"
      ],
      "provenance": {
        "repository": "https://github.com/nebius/nebius-solutions-library",
        "commit_sha": "229101bb5430143e78c4bc796b30715a2a0a14df",
        "commit_url": "https://github.com/nebius/nebius-solutions-library/commit/229101bb5430143e78c4bc796b30715a2a0a14df",
        "path": "nim-fast-start/faststart-v2/resource-broker/SMOKE_EVIDENCE.md",
        "blob_sha256": "28e03e04db7f9812dd68a7e345695620fca59a0080c3bb697ced3abdf5a2332a"
      },
      "review_record_id": "RR1-BROKER-2291-PROVENANCE-UNVERIFIED"
    },
    {
      "id": "EV3-OF2-PREPARED-0180",
      "lane": "prepared-node-feasibility",
      "subject": "OpenFold2 prepared-node n20 cohort",
      "backends": [
        "kubernetes"
      ],
      "classification": "provenance-unverified",
      "measurement_kind": "prepared-stage",
      "positive_evidence_eligible": false,
      "decision_score_eligible": false,
      "allowed_claim": "The exact prepared-stage source file exists; its review disposition is not independently commit-bound.",
      "excluded_claims": [
        "unknown-model product-boundary latency",
        "independently accepted measurement"
      ],
      "provenance": {
        "repository": "https://github.com/nebius/nebius-solutions-library",
        "commit_sha": "0180915001fff47fbed0f82292fe32edc40e40ea",
        "commit_url": "https://github.com/nebius/nebius-solutions-library/commit/0180915001fff47fbed0f82292fe32edc40e40ea",
        "path": "nim-fast-start/faststart-v2/performance/openfold2/fresh-cohort-n20-results.tsv",
        "blob_sha256": "b5e3bf5d28c3da0b8a3407dee51aaff8b45fce73f16929b632ca971deb513b03"
      },
      "review_record_id": "RR1-PREPARED-0180-PROVENANCE-UNVERIFIED"
    },
    {
      "id": "EV3-BOLTZ-PREPARED-0180",
      "lane": "prepared-node-feasibility",
      "subject": "Boltz2 prepared-node n20 cohort",
      "backends": [
        "kubernetes"
      ],
      "classification": "provenance-unverified",
      "measurement_kind": "prepared-stage",
      "positive_evidence_eligible": false,
      "decision_score_eligible": false,
      "allowed_claim": "The exact prepared-stage source file exists; its review disposition is not independently commit-bound.",
      "excluded_claims": [
        "unknown-model product-boundary latency",
        "independently accepted measurement"
      ],
      "provenance": {
        "repository": "https://github.com/nebius/nebius-solutions-library",
        "commit_sha": "0180915001fff47fbed0f82292fe32edc40e40ea",
        "commit_url": "https://github.com/nebius/nebius-solutions-library/commit/0180915001fff47fbed0f82292fe32edc40e40ea",
        "path": "nim-fast-start/faststart-v2/boltz2-native/fresh-cohort-n20-results.tsv",
        "blob_sha256": "ec36c85052f62878c22d3e6320845d5e74fb342612d5e1b367d422e9beedad58"
      },
      "review_record_id": "RR1-PREPARED-0180-PROVENANCE-UNVERIFIED"
    },
    {
      "id": "EV3-DRAIN-34D-REJECTED",
      "lane": "drain-reclaim",
      "subject": "Original drain/reclaim implementation",
      "backends": [
        "kubernetes",
        "node-vm"
      ],
      "classification": "rejected",
      "measurement_kind": "offline-test",
      "positive_evidence_eligible": false,
      "decision_score_eligible": false,
      "allowed_claim": "The exact commit is negative review evidence for missing physical, fencing, durability, semantic, and rollback proof.",
      "excluded_claims": [
        "Must not be used as a production design input or live implementation."
      ],
      "provenance": {
        "repository": "https://github.com/nebius/nebius-solutions-library",
        "commit_sha": "34d70fd0b4c84ddd2375a9db1ec9d9961f4aa5be",
        "commit_url": "https://github.com/nebius/nebius-solutions-library/commit/34d70fd0b4c84ddd2375a9db1ec9d9961f4aa5be",
        "path": "nim-fast-start/faststart-v2/catalog-switch/drain-reclaim/contract.json",
        "blob_sha256": "7d639d545db3ee9a3411c7c729ab7925510728b589e9e782eaea62e949a93d29"
      },
      "review_record_id": "RR1-DRAIN-34D-REJECTED"
    },
    {
      "id": "EV3-SNAPSHOT-F5F-REJECTED",